{
  "version": 1,
  "runId": "00000000-0000-4000-8000-000000000000",
  "provenance": {
    "node": "v26.0.0",
    "playwright": "1.61.0",
    "lockSha256": "0000000000000000000000000000000000000000000000000000000000000000",
    "browserRevision": "0",
    "sourceCommit": "0000000000000000000000000000000000000000"
  },
  "cases": [],
  "suiteError": null,
  "cleanupErrors": []
}
